{
  "$schema": "https://json-schema.org/draft/2020-12/schema",
  "$id": "https://klimpaskov.github.io/hoi4-mod-setup/schemas/transaction-journal.schema.json",
  "title": "Transaction Journal",
  "type": "object",
  "additionalProperties": false,
  "required": [
    "schema_version",
    "transaction_id",
    "project_id",
    "state",
    "created_at",
    "last_checkpoint",
    "stages",
    "operations",
    "recovery"
  ],
  "properties": {
    "schema_version": {
      "type": "string"
    },
    "transaction_id": {
      "type": "string",
      "format": "uuid"
    },
    "transaction_kind": {
      "enum": [
        "installation",
        "rollback"
      ]
    },
    "parent_transaction_id": {
      "type": [
        "string",
        "null"
      ],
      "format": "uuid"
    },
    "rollback_transaction_id": {
      "type": [
        "string",
        "null"
      ],
      "format": "uuid"
    },
    "project_id": {
      "type": "string"
    },
    "project_root": {
      "type": "string"
    },
    "state": {
      "enum": [
        "preflight",
        "resolving",
        "downloading",
        "verifying",
        "reviewed",
        "backing_up",
        "staging",
        "validating",
        "applying",
        "post_check",
        "reporting",
        "finalizing",
        "completed",
        "interrupted",
        "staging_discarded",
        "rolling_back",
        "rolled_back",
        "failed"
      ]
    },
    "created_at": {
      "type": "string",
      "format": "date-time"
    },
    "updated_at": {
      "type": "string",
      "format": "date-time"
    },
    "last_checkpoint": {
      "type": "string"
    },
    "plan_sha256": {
      "type": "string",
      "pattern": "^[0-9a-f]{64}$"
    },
    "git_initialized": {
      "type": "boolean"
    },
    "git_remote_added_name": {
      "type": [
        "string",
        "null"
      ]
    },
    "git_remote_added_url": {
      "type": [
        "string",
        "null"
      ]
    },
    "stages": {
      "type": "array",
      "items": {
        "type": "object",
        "required": [
          "id",
          "status"
        ],
        "properties": {
          "id": {
            "type": "string"
          },
          "status": {
            "enum": [
              "pending",
              "active",
              "complete",
              "failed",
              "skipped"
            ]
          },
          "started_at": {
            "type": [
              "string",
              "null"
            ]
          },
          "completed_at": {
            "type": [
              "string",
              "null"
            ]
          },
          "evidence": {
            "type": "array",
            "items": {
              "type": "string"
            }
          }
        }
      }
    },
    "operations": {
      "type": "array",
      "items": {
        "type": "object",
        "required": [
          "id",
          "status",
          "destination",
          "ownership"
        ],
        "properties": {
          "id": {
            "type": "string"
          },
          "status": {
            "enum": [
              "pending",
              "staged",
              "applying",
              "applied",
              "verified",
              "rollback_applying",
              "rolled_back",
              "failed"
            ]
          },
          "destination": {
            "type": "string"
          },
          "ownership": {
            "enum": [
              "managed",
              "merged",
              "generated",
              "external",
              null
            ]
          },
          "component_id": {
            "type": [
              "string",
              "null"
            ]
          },
          "action": {
            "enum": [
              "create",
              "replace",
              "merge",
              "rename",
              "skip",
              "delete_managed",
              "generate",
              "chmod",
              "external",
              null
            ]
          },
          "location_scope": {
            "enum": [
              "project",
              "external_launcher",
              "application_data",
              null
            ]
          },
          "external": {
            "type": "boolean"
          },
          "backup_path": {
            "type": [
              "string",
              "null"
            ]
          },
          "before_sha256": {
            "type": [
              "string",
              "null"
            ]
          },
          "expected_sha256": {
            "type": [
              "string",
              "null"
            ]
          },
          "source_sha256": {
            "type": [
              "string",
              "null"
            ],
            "pattern": "^[0-9a-f]{64}$"
          },
          "result_sha256": {
            "type": [
              "string",
              "null"
            ],
            "pattern": "^[0-9a-f]{64}$"
          },
          "rollback": {
            "enum": [
              "remove_created",
              "restore_backup",
              "reverse_merge",
              "none",
              null
            ]
          },
          "rollback_source_path": {
            "type": [
              "string",
              "null"
            ]
          },
          "backup_sha256": {
            "type": [
              "string",
              "null"
            ],
            "pattern": "^[0-9a-f]{64}$"
          },
          "after_sha256": {
            "type": [
              "string",
              "null"
            ]
          },
          "after_exists": {
            "type": [
              "boolean",
              "null"
            ]
          }
        }
      }
    },
    "recovery": {
      "type": "object",
      "required": [
        "resume_allowed",
        "rollback_allowed",
        "discard_staging_allowed",
        "project_apply_started"
      ],
      "properties": {
        "resume_allowed": {
          "type": "boolean"
        },
        "rollback_allowed": {
          "type": "boolean"
        },
        "discard_staging_allowed": {
          "type": "boolean"
        },
        "project_apply_started": {
          "type": "boolean"
        },
        "recommended_action": {
          "enum": [
            "resume",
            "rollback",
            "discard_staging",
            "inspect",
            "none"
          ]
        }
      }
    },
    "git_initialized": {
      "type": "boolean"
    },
    "previous_lock_backup_path": {
      "type": [
        "string",
        "null"
      ]
    },
    "previous_lock_sha256": {
      "type": [
        "string",
        "null"
      ],
      "pattern": "^[0-9a-f]{64}$"
    },
    "error": {
      "type": [
        "object",
        "null"
      ],
      "properties": {
        "code": {
          "type": "string"
        },
        "message": {
          "type": "string"
        },
        "stage": {
          "type": "string"
        }
      }
    }
  }
}
